{
  "authorization_event_id": "authz_sha256_3333333333333333333333333333333333333333333333333333333333333333",
  "blocked_memory_revision_ids": [
    "memory_revision_sha256_2222222222222222222222222222222222222222222222222222222222222222"
  ],
  "candidate_memory_revision_ids": [
    "memory_revision_sha256_1111111111111111111111111111111111111111111111111111111111111111",
    "memory_revision_sha256_2222222222222222222222222222222222222222222222222222222222222222"
  ],
  "contract_version": "tbm.usage-decision.v3",
  "created_at": "2026-07-30T01:00:00Z",
  "decision_id": "decision_usage_001",
  "final_memory_revision_ids": [
    "memory_revision_sha256_1111111111111111111111111111111111111111111111111111111111111111"
  ],
  "injection_artifact_id": "artifact_sha256_14ab637361520afdbcead6f40bd0814d6390111f9954a85ececdf0eba86ab6ad",
  "policy_bundle_sha256": "sha256:7777777777777777777777777777777777777777777777777777777777777777",
  "reason": "Only the reviewed procedural memory remains applicable.",
  "recommended_injection": "summary",
  "renderer_id": "tbm.structured-memory-json",
  "renderer_version": "v1",
  "replay_components": {
    "ancestry_evidence": "sha256:7777777777777777777777777777777777777777777777777777777777777777",
    "injection_artifact": "sha256:14ab637361520afdbcead6f40bd0814d6390111f9954a85ececdf0eba86ab6ad",
    "policy_bundle": "sha256:8888888888888888888888888888888888888888888888888888888888888888",
    "renderer": "sha256:9999999999999999999999999999999999999999999999999999999999999999",
    "retrieval_snapshot": "sha256:3333333333333333333333333333333333333333333333333333333333333333",
    "semantic_gate_prompt": "sha256:5555555555555555555555555555555555555555555555555555555555555555",
    "semantic_gate_response": "sha256:6666666666666666666666666666666666666666666666666666666666666666",
    "system_gate_evaluation": "sha256:4444444444444444444444444444444444444444444444444444444444444444"
  },
  "retrieval_snapshot_id": "retrieval_snapshot_sha256_4444444444444444444444444444444444444444444444444444444444444444",
  "risk": "low",
  "run_id": "run_usage_001",
  "semantic_allowed_memory_revision_ids": [
    "memory_revision_sha256_1111111111111111111111111111111111111111111111111111111111111111"
  ],
  "semantic_gate_attempt_id": "semantic_attempt_sha256_6666666666666666666666666666666666666666666666666666666666666666",
  "session_id": "gate_session_usage_001",
  "system_allowed_memory_revision_ids": [
    "memory_revision_sha256_1111111111111111111111111111111111111111111111111111111111111111"
  ],
  "system_blocked": [
    {
      "memory_revision_id": "memory_revision_sha256_2222222222222222222222222222222222222222222222222222222222222222",
      "reason_code": "memory_type_blocked",
      "rule_id": "system_policy_v1"
    }
  ],
  "system_gate_evaluation_id": "system_gate_sha256_5555555555555555555555555555555555555555555555555555555555555555",
  "trace_id": "trace_usage_001",
  "usage_decision_id": "usage_decision_sha256_6d43da4b4c5635d9e2a5cb4ad34ca780e37fc2e6d77f5074dd5785e413761037"
}
